{"version":"openaction-change/1.0-rc1","id":"oac_model_vendor_change_001","subject":"CareOS demo 1.0","changes":[{"dimension":"model","before":"Model A","after":"Model B","reason":"provider change"},{"dimension":"vendor","before":"Vendor A","after":"Vendor B","reason":"hosting migration"}],"gate_impacts":[{"gate_id":"gate_ai_eval","impact":"reopen","reason":"model changed"},{"gate_id":"gate_privacy","impact":"verify","reason":"vendor/subprocessor changed"},{"gate_id":"gate_clinical_workflow","impact":"unchanged","reason":"workflow and intended use unchanged"}],"generated_at":"2026-08-24T09:40:00Z","human_review_required":true}